<?xml version="1.0" encoding="UTF-8"?>
<!DOCTYPE note SYSTEM "form1.dtd">
<form1>
<fname>Aravindh</fname>
<lname>Venkat</lname>
<org>Amrita</org>
<tit>Prof</tit>
<rts>Prof</rts>
<tel>123345</tel>
<email>abc@gmail.com</email>
</form1>